鄉鎮市區,交易標的,土地區段位置建物區段門牌,土地面積平方公尺,都市土地使用分區,非都市土地使用分區,非都市土地使用編定,租賃年月日,租賃筆棟數,租賃層次,總樓層數,建物型態,主要用途,主要建材,建築完成年月,建物總面積平方公尺,建物現況格局-房,建物現況格局-廳,建物現況格局-衛,建物現況格局-隔間,有無管理組織,有無附傢俱,總額元,單價元平方公尺,車位類別,車位面積平方公尺,車位總額元,備註,編號
The villages and towns urban district,transaction sign,land sector position building sector house number plate,land shifting total area square meter,the use zoning or compiles and checks,the non-metropolis land use district,non-metropolis land use,transaction year month and day,transaction pen number,shifting level,total floor number,building state,main use,main building materials,construction to complete the years,building shifting total area,Building present situation pattern - room,building present situation pattern - hall,building present situation pattern - health,building present situation pattern - compartmented,Whether there is manages the organization,Whether there is attaches the furniture,total price NTD,the unit price (NTD / square meter),the berth category,berth shifting total area square meter,the berth total price NTD,the note,serial number
苗栗市,房地(土地+建物),苗栗縣苗栗市府前路61~90號,265.0,住,,,1080829,土地1建物1車位0,全,3,透天厝,住家用,鋼筋混凝土造,0831101,19.83,0,0,0,無,無,無,13000,656,,0.0,0,有民情風俗因素之交易。;承租屋後加建部份,RPQNMLTJRHOFFBK17CC
苗栗市,房地(土地+建物),苗栗縣苗栗市蕉嶺街31~60號,19.65,住,,,1080926,土地1建物1車位0,,8,華廈(10層含以下有電梯),國民住宅,鋼筋混凝土造,0871210,84.13,3,2,2,有,有,有,10000,119,,0.0,0,,RPQNMLLJIIOFFBK18CC
造橋鄉,土地,牛欄湖段871~900地號,21901.0,,山坡地保育區,農牧用地,1080926,土地1建物0車位0,,,其他,,,,0.0,0,0,0,有,無,無,18250,1,,0.0,0,,RPUOMLNJIIOFFDK56DC
苗栗市,房地(土地+建物)+車位,苗栗縣苗栗市福麗里28鄰名門街61~90號,45.26,住,,,1081003,土地1建物1車位1,五層,5,華廈(10層含以下有電梯),住家用,鋼筋混凝土造,1030710,140.84,3,2,2,有,有,有,17777,126,一樓平面,0.0,0,,RPPNMLOJIIOFFBK38CC
苗栗市,建物,苗栗縣苗栗市水源里7鄰水源1~30號,0.0,住,,,1080921,土地0建物1車位0,全,2,透天厝,住家用,加強磚造,0710420,80.66,2,1,2,有,無,有,8000,99,,0.0,0,有民情風俗因素之交易。;,RPQNMLQKIIOFFBK78CC
苗栗市,建物,苗栗縣苗栗市綠苗里15鄰光復路61~90號,0.0,商,,,1081001,土地0建物1車位0,全,5,透天厝,住商用,鋼筋混凝土造,0830406,56.87,0,1,1,有,無,無,20000,352,,0.0,0,,RPQNMLTLIIOFFBK56CC
苗栗市,建物,苗栗縣苗栗市玉清里2鄰玉清路31~60號,0.0,,鄉村區,乙種建築用地,1081003,土地0建物1車位0,全,2,透天厝,住商用,鋼筋混凝土造,0981215,254.93,3,2,2,有,無,有,24000,94,,0.0,0,,RPSNMLKMIIOFFBK58CC
苗栗市,房地(土地+建物)+車位,苗栗縣苗栗市北苗里19鄰文?街91~120號,445.0,住,,,1081031,土地1建物1車位1,七層,7,華廈(10層含以下有電梯),住家用,鋼筋混凝土造,1041116,156.73000000000002,3,2,2,有,有,有,15000,96,一樓平面,0.0,0,,RPPNMLPJJIOFFBK58CC
