鄉鎮市區,交易標的,土地區段位置建物區段門牌,土地面積平方公尺,都市土地使用分區,非都市土地使用分區,非都市土地使用編定,租賃年月日,租賃筆棟數,租賃層次,總樓層數,建物型態,主要用途,主要建材,建築完成年月,建物總面積平方公尺,建物現況格局-房,建物現況格局-廳,建物現況格局-衛,建物現況格局-隔間,有無管理組織,有無附傢俱,總額元,單價元平方公尺,車位類別,車位面積平方公尺,車位總額元,備註,編號
The villages and towns urban district,transaction sign,land sector position building sector house number plate,land shifting total area square meter,the use zoning or compiles and checks,the non-metropolis land use district,non-metropolis land use,transaction year month and day,transaction pen number,shifting level,total floor number,building state,main use,main building materials,construction to complete the years,building shifting total area,Building present situation pattern - room,building present situation pattern - hall,building present situation pattern - health,building present situation pattern - compartmented,Whether there is manages the organization,Whether there is attaches the furniture,total price NTD,the unit price (NTD / square meter),the berth category,berth shifting total area square meter,the berth total price NTD,the note,serial number
頭份巿,建物,苗栗縣頭份鎮民族路211~240號,153.13,住,,,1041110,土地0建物1車位0,一層,2,店面(店鋪),住家用,加強磚造,0591015,119.28,0,0,0,無,無,有,15000,126,,0.0,0,,RPRNMLPLJIKFFFK09DC
苗栗市,房地(土地+建物),苗栗縣苗栗市國華路961~990號,109.33,住,,,1041120,土地1建物1車位0,全,4,透天厝,住商用,鋼筋混凝土造,1000302,262.17,4,2,5,有,無,有,33000,126,,0.0,0,,RPUNMLOLKIKFFBK88CC
苗栗市,房地(土地+建物),苗栗縣苗栗市建功里24鄰精武街1~30號,664.0,住,,,1041223,土地1建物1車位0,一層,8,華廈(10層含以下有電梯),商業用,鋼筋混凝土造,0870415,119.81,0,0,1,有,有,無,18000,150,,0.0,0,,RPPNMLPLKIKFFBK48CC
苗栗市,房地(土地+建物),苗栗縣苗栗市恭敬里11鄰東海街1~30號,3.56,住,,,1041223,土地1建物1車位0,五層,7,華廈(10層含以下有電梯),住家用,鋼筋混凝土造,0840601,115.7,3,1,2,有,無,無,10500,91,,0.0,0,,RPOOMLSLKIKFFBK78CC
竹南鎮,房地(土地+建物),苗栗縣竹南鎮崎頂里15鄰和興街331~360號,2156.0,,工業區,丁種建築用地,1041229,土地1建物1車位0,見其他登記事項,1,廠辦,工商用,鋼筋混凝土造,0760420,1100.5,0,0,1,有,無,無,125000,114,,0.0,0,,RPRNMLQLJHLFFDK98DC
