鄉鎮市區,交易標的,土地區段位置建物區段門牌,土地面積平方公尺,都市土地使用分區,非都市土地使用分區,非都市土地使用編定,租賃年月日,租賃筆棟數,租賃層次,總樓層數,建物型態,主要用途,主要建材,建築完成年月,建物總面積平方公尺,建物現況格局-房,建物現況格局-廳,建物現況格局-衛,建物現況格局-隔間,有無管理組織,有無附傢俱,總額元,單價元平方公尺,車位類別,車位面積平方公尺,車位總額元,備註,編號
The villages and towns urban district,transaction sign,land sector position building sector house number plate,land shifting total area square meter,the use zoning or compiles and checks,the non-metropolis land use district,non-metropolis land use,transaction year month and day,transaction pen number,shifting level,total floor number,building state,main use,main building materials,construction to complete the years,building shifting total area,Building present situation pattern - room,building present situation pattern - hall,building present situation pattern - health,building present situation pattern - compartmented,Whether there is manages the organization,Whether there is attaches the furniture,total price NTD,the unit price (NTD / square meter),the berth category,berth shifting total area square meter,the berth total price NTD,the note,serial number
中正區,建物,基隆市中正區正義路100巷31~60號,0.0,其他,,,1071030,土地0建物1車位0,二層,2,公寓(5樓含以下無電梯),住家用,加強磚造,0641027,48.83,5,0,3,有,無,有,15000,307,,0.0,0,,RPPNMLMKJINFFBC47CC
中正區,建物,基隆市中正區新豐街333巷31~60號,0.0,住,,,1071106,土地0建物1車位0,三層,9,華廈(10層含以下有電梯),住家用,鋼筋混凝土造,0841122,105.54,3,2,2,有,有,有,8500,81,,0.0,0,,RPQNMLMKJINFFBC57CC
仁愛區,房地(土地+建物),基隆市仁愛區仁一路241~270號,3.17,商,,,1071109,土地1建物1車位0,十三層,31,套房(1房1廳1衛),住家用,鋼骨鋼筋混凝土造,0970204,57.59,1,1,1,有,有,有,16000,278,,0.0,0,電視一台、冰箱一台、冷氣一台、沙發一組、桌子一張、熱水器一台,RPOOMLNKJINFFBC57CC
七堵區,土地,大華段1441~1470地號,0.0,商,,,1071104,土地1建物0車位0,,,其他,,,,0.0,2,0,0,有,無,無,11000,0,,0.0,0,有民情風俗因素之交易。;本案為2樓公寓，權利屋案件，面積約為76平方公尺，2房2廳1衛,RPPOMLPKJINFFCC97CC
仁愛區,房地(土地+建物),基隆市仁愛區劉銘傳路43巷1~30號,75.0,住,,,1071101,土地1建物1車位0,全,2,透天厝,住家用,加強磚造,0550101,50.0,2,1,1,有,無,有,12000,240,,0.0,0,有民情風俗因素之交易。;本案為頂樓加蓋，面積約為50平方公尺,RPSOMLRLJINFFBC48CC
信義區,房地(土地+建物),基隆市信義區深溪路38巷1~30號,24.51,住,,,1071209,土地1建物1車位0,五層,10,華廈(10層含以下有電梯),見其他登記事項,鋼筋混凝土造,1061109,83.09,3,1,1,有,有,有,12000,144,,0.0,0,,RPQNMLRLKINFFBC28CC
安樂區,房地(土地+建物),基隆市安樂區麥金路151~180號,15.49,住,,,1071106,土地8建物1車位0,四層,12,住宅大樓(11層含以上有電梯),住家用,鋼筋混凝土造,0860718,114.58,3,2,2,有,有,有,17000,148,,0.0,0,管理費,RPVNMLQKJHOFFCC68DC
