鄉鎮市區,交易標的,土地區段位置建物區段門牌,土地面積平方公尺,都市土地使用分區,非都市土地使用分區,非都市土地使用編定,租賃年月日,租賃筆棟數,租賃層次,總樓層數,建物型態,主要用途,主要建材,建築完成年月,建物總面積平方公尺,建物現況格局-房,建物現況格局-廳,建物現況格局-衛,建物現況格局-隔間,有無管理組織,有無附傢俱,總額元,單價元平方公尺,車位類別,車位面積平方公尺,車位總額元,備註,編號
The villages and towns urban district,transaction sign,land sector position building sector house number plate,land shifting total area square meter,the use zoning or compiles and checks,the non-metropolis land use district,non-metropolis land use,transaction year month and day,transaction pen number,shifting level,total floor number,building state,main use,main building materials,construction to complete the years,building shifting total area,Building present situation pattern - room,building present situation pattern - hall,building present situation pattern - health,building present situation pattern - compartmented,Whether there is manages the organization,Whether there is attaches the furniture,total price NTD,the unit price (NTD / square meter),the berth category,berth shifting total area square meter,the berth total price NTD,the note,serial number
嘉義市,房地(土地+建物),嘉義市嘉義市新民路691~720號,110.0,住,,,1040423,土地1建物1車位0,見其他登記事項,4,店面(店鋪),住商用,鋼筋混凝土造,0731126,265.98,4,2,4,有,無,無,35000,132,,0.0,0,,RPVNMLMLNHKFFAI68CC
嘉義市,房地(土地+建物),嘉義市嘉義市博愛路一段496巷1~30號,29.84,住,,,1040427,土地1建物1車位0,一層,7,華廈(10層含以下有電梯),住商用,鋼筋混凝土造,0800518,128.95,2,2,1,有,無,無,10000,78,,0.0,0,,RPSNMLQLNHKFFAI78CC
嘉義市,房地(土地+建物)+車位,嘉義市嘉義市西區永安街361~390號,32.98,住,,,1040601,土地1建物1車位1,十一層,12,住宅大樓(11層含以上有電梯),住家用,鋼筋混凝土造,0931028,187.32,3,2,2,有,有,有,24000,128,坡道平面,0.0,0,,RPSNMLLJOHKFFAI28DC
嘉義市,房地(土地+建物),嘉義市嘉義市泰瑞二街31~60號,37.39,住,,,1040528,土地1建物1車位0,一層,7,華廈(10層含以下有電梯),住商用,鋼筋混凝土造,0820712,36.39,0,0,1,無,有,無,4000,110,,0.0,0,,RPUNMLLJOHKFFAI58EC
嘉義市,房地(土地+建物),嘉義市嘉義市永福一街1~30號,415.0,住,,,1040519,土地1建物1車位0,六層,8,華廈(10層含以下有電梯),住家用,鋼筋混凝土造,0821102,74.35,3,1,1,有,無,有,10000,134,,0.0,0,,RPWNMLNJOHKFFAI78CC
嘉義市,房地(土地+建物),嘉義市嘉義市新民路728巷1~30號,112.0,住,,,1040528,土地2建物1車位0,全,2,透天厝,住家用,鋼筋混凝土加強磚造,0620524,127.78,3,2,2,有,無,有,12000,94,,0.0,0,,RPXNMLNJOHKFFAI88CC
嘉義市,房地(土地+建物),嘉義市嘉義市嘉義市西區仁愛路211~240號,36.59,住,,,1040604,土地1建物1車位0,一層,14,店面(店鋪),商業用,鋼筋混凝土造,0931028,205.05,0,0,0,無,有,無,35000,171,,0.0,0,"起租日104年7月4日,有一個含在大公設裡的坡道平面式車位可使用",RPTNMLOJOHKFFAI58CC
嘉義市,房地(土地+建物)+車位,嘉義市嘉義市西區新榮路35巷1~30號,35.56,住,,,1040615,土地1建物1車位1,七層,14,住宅大樓(11層含以上有電梯),住家用,鋼筋混凝土造,0931028,207.08999999999997,4,2,2,有,有,有,24000,116,坡道平面,0.0,0,,RPUNMLPKOHKFFAI98DC
嘉義市,房地(土地+建物),嘉義市嘉義市西榮街31~60號,62.0,住,,,1040614,土地1建物1車位0,全,2,透天厝,住家用,鋼筋混凝土加強磚造,0590815,110.9,3,2,1,有,無,無,12000,108,,0.0,0,,RPPNMLLLOHKFFAI08CC
嘉義市,建物,嘉義市嘉義市東區小雅路181~210號,0.0,,,,1040630,土地0建物1車位0,六層,16,套房(1房1廳1衛),住家用,鋼筋混凝土造,0820609,39.5,1,1,1,有,有,有,4000,101,,0.0,0,,RPSNMLMJPHKFFAI38CC
嘉義市,房地(土地+建物),嘉義市嘉義市博東路151~180號,15.28,住,,,1040611,土地1建物1車位0,十四層,22,住宅大樓(11層含以上有電梯),住家用,鋼筋混凝土造,0870319,124.31,3,2,2,有,有,有,10000,80,坡道平面,0.0,0,,RPWOMLRJPHKFFAI86DC
嘉義市,建物,嘉義市嘉義市林森東路721~750號,83.38,住,,,1040625,土地0建物1車位0,一層,13,住宅大樓(11層含以上有電梯),商業用,鋼筋混凝土造,0920317,337.37,0,0,0,無,有,無,15000,44,,0.0,0,,RPXNMLSJPHKFFAI96DC
嘉義市,房地(土地+建物),嘉義市嘉義市博東路151~180號,15.28,住,,,1040616,土地1建物1車位0,五層,22,住宅大樓(11層含以上有電梯),住家用,鋼筋混凝土造,0870319,124.74,3,2,2,有,有,有,10000,80,坡道平面,0.0,0,,RPWNMLOKPHKFFAI56DC
嘉義市,房地(土地+建物),嘉義市嘉義市博東路151~180號,18.49,住,,,1040629,土地1建物1車位0,十四層,22,住宅大樓(11層含以上有電梯),住家用,鋼筋混凝土造,0870319,147.53,4,2,2,有,有,有,15000,102,坡道平面,0.0,0,續租。含稅金、二代健保等費用。,RPSNMLRLPHKFFAI56DC
嘉義市,房地(土地+建物),嘉義市嘉義市博東路151~180號,14.48,住,,,1040629,土地1建物1車位0,十二層,22,住宅大樓(11層含以上有電梯),住家用,鋼筋混凝土造,0870319,119.94,3,2,2,有,有,有,14000,117,坡道平面,0.0,0,續租。含稅金等費用。,RPTNMLRLPHKFFAI66DC
嘉義市,建物,嘉義市嘉義市北榮街121~150號,0.0,,,,1040726,土地0建物1車位0,全,4,透天厝,住商用,鋼筋混凝土造,0720210,96.98,0,0,0,無,無,無,13000,134,,0.0,0,"房屋雖為4樓透天但租屋範圍為一樓48.20平方公尺和一個地下室48.78平方公尺,其餘2,3,4樓沒有出租,起租日為104年10月1日",RPWNMLRLPHKFFAI86CC
