鄉鎮市區,交易標的,土地區段位置建物區段門牌,土地面積平方公尺,都市土地使用分區,非都市土地使用分區,非都市土地使用編定,租賃年月日,租賃筆棟數,租賃層次,總樓層數,建物型態,主要用途,主要建材,建築完成年月,建物總面積平方公尺,建物現況格局-房,建物現況格局-廳,建物現況格局-衛,建物現況格局-隔間,有無管理組織,有無附傢俱,總額元,單價元平方公尺,車位類別,車位面積平方公尺,車位總額元,備註,編號
The villages and towns urban district,transaction sign,land sector position building sector house number plate,land shifting total area square meter,the use zoning or compiles and checks,the non-metropolis land use district,non-metropolis land use,transaction year month and day,transaction pen number,shifting level,total floor number,building state,main use,main building materials,construction to complete the years,building shifting total area,Building present situation pattern - room,building present situation pattern - hall,building present situation pattern - health,building present situation pattern - compartmented,Whether there is manages the organization,Whether there is attaches the furniture,total price NTD,the unit price (NTD / square meter),the berth category,berth shifting total area square meter,the berth total price NTD,the note,serial number
苗栗市,房地(土地+建物),苗栗縣苗栗市玉華里玉清街222巷55弄1~30號,133.0,,特定農業區,甲種建築用地,1060715,土地1建物1車位0,全,3,透天厝,住家用,鋼筋混凝土造,0860710,116.0,2,2,3,有,無,有,11000,95,,0.0,0,,RPQNMLMJQHMFFBK88DC
苗栗市,房地(土地+建物)+車位,苗栗縣苗栗市縣府路91~120號,10.0,住,,,1060727,土地1建物1車位1,七層,12,住宅大樓(11層含以上有電梯),住家用,鋼筋混凝土造,0881206,116.0,3,2,2,有,無,有,14000,121,坡道機械,0.0,0,,RPRNMLMJQHMFFBK98DC
苗栗市,建物,苗栗縣苗栗市福星里5鄰福星街181~210號,0.0,住,,,1060910,土地0建物1車位0,十六層,17,住宅大樓(11層含以上有電梯),住家用,鋼筋混凝土造,0810929,192.34,4,1,2,有,有,有,11000,57,,0.0,0,,RPTNMLNJIIMFFBK48CC
苗栗市,房地(土地+建物),苗栗縣苗栗市縣府路91~120號,15.0,住,,,1061001,土地1建物1車位0,八層,13,住宅大樓(11層含以上有電梯),住家用,鋼筋混凝土造,0881206,95.0,3,2,2,有,無,有,14000,147,,0.0,0,,RPUNMLPJIIMFFBK88DC
苗栗市,房地(土地+建物),苗栗縣苗栗市新苗里4鄰南光1~30號,89.0,住,,,1061022,土地1建物1車位0,全,3,透天厝,住商用,見其他登記事項,0650217,109.94,3,1,2,有,無,無,8000,73,,0.0,0,,RPPNMLNLIIMFFBK28CC
苗栗市,房地(土地+建物),苗栗縣苗栗市為公路421~450號,139.4,住,,,1061031,土地1建物1車位0,見其他登記事項,2,店面(店鋪),住商用,加強磚造,,197.03,0,0,0,無,無,無,16000,81,,0.0,0,,RPSOMLLMIIMFFBK58CC
苗栗市,建物,苗栗縣苗栗市綠苗里15鄰光復路61~90號,0.0,商,,,1061020,土地0建物1車位0,全,5,透天厝,住商用,鋼筋混凝土造,0830406,56.87,0,1,1,有,無,無,20000,352,,0.0,0,,RPRNMLMJJIMFFBK28CC
