鄉鎮市區,交易標的,土地區段位置建物區段門牌,土地面積平方公尺,都市土地使用分區,非都市土地使用分區,非都市土地使用編定,租賃年月日,租賃筆棟數,租賃層次,總樓層數,建物型態,主要用途,主要建材,建築完成年月,建物總面積平方公尺,建物現況格局-房,建物現況格局-廳,建物現況格局-衛,建物現況格局-隔間,有無管理組織,有無附傢俱,總額元,單價元平方公尺,車位類別,車位面積平方公尺,車位總額元,備註,編號
The villages and towns urban district,transaction sign,land sector position building sector house number plate,land shifting total area square meter,the use zoning or compiles and checks,the non-metropolis land use district,non-metropolis land use,transaction year month and day,transaction pen number,shifting level,total floor number,building state,main use,main building materials,construction to complete the years,building shifting total area,Building present situation pattern - room,building present situation pattern - hall,building present situation pattern - health,building present situation pattern - compartmented,Whether there is manages the organization,Whether there is attaches the furniture,total price NTD,the unit price (NTD / square meter),the berth category,berth shifting total area square meter,the berth total price NTD,the note,serial number
六腳鄉,土地,牛埔段31~60地號,520.0,住,,,1060823,土地1建物0車位0,,,其他,,,,0.0,0,0,0,有,無,有,38000,73,,0.0,0,,RPSNMLNLQHMFFBQ27CC
布袋鎮,房地(土地+建物),嘉義縣布袋鎮中正路1~30號,1323.0,住,,,1060823,土地1建物1車位0,一層,1,其他,見其他登記事項,鋼造,0800913,845.89,0,0,0,無,無,有,45000,53,,0.0,0,,RPTNMLOLQHMFFBQ47CC
朴子市,土地,文明段661~690地號,432.4,住,,,1060901,土地1建物0車位0,,,其他,,,,0.0,0,0,0,有,無,有,13000,30,,0.0,0,建物無保存登記,RPRNMLLJRHMFFBQ86CC
朴子市,房地(土地+建物),嘉義縣朴子市仁和二路121~150號,7.6,住,,,1060920,土地1建物1車位0,八層,8,套房(1房1廳1衛),住家用,鋼筋混凝土造,0950828,19.19,1,1,1,有,無,有,3000,156,,0.0,0,,RPRNMLPLRHMFFBQ47CC
太保市,房地(土地+建物),嘉義縣太保市寶鐵一路二段91~120號,29.33,住,,,1060911,土地1建物1車位0,十四層,16,住宅大樓(11層含以上有電梯),集合住宅,鋼筋混凝土造,1060421,63.79,3,2,2,有,有,有,12000,188,,0.0,0,,RPPNMLNJIIMFFDQ88CC
水上鄉,房地(土地+建物),嘉義縣水上鄉柳子林61~90號,47.66,,鄉村區,乙種建築用地,1061001,土地1建物1車位0,全,3,透天厝,住商用,鋼筋混凝土加強磚造,0670716,103.2,4,2,3,有,無,無,8000,78,,0.0,0,,RPQNMLTKIIMFFDQ07CC
太保市,房地(土地+建物),嘉義縣太保市祥和三路東段271~300號,98.25,住,,,1061108,土地1建物1車位0,見其他登記事項,4,店面(店鋪),住商用,鋼筋混凝土造,0970703,184.28,4,2,2,有,無,無,20000,109,,0.0,0,,RPPNMLTJJIMFFDQ96CC
