鄉鎮市區,交易標的,土地區段位置建物區段門牌,土地面積平方公尺,都市土地使用分區,非都市土地使用分區,非都市土地使用編定,租賃年月日,租賃筆棟數,租賃層次,總樓層數,建物型態,主要用途,主要建材,建築完成年月,建物總面積平方公尺,建物現況格局-房,建物現況格局-廳,建物現況格局-衛,建物現況格局-隔間,有無管理組織,有無附傢俱,總額元,單價元平方公尺,車位類別,車位面積平方公尺,車位總額元,備註,編號
The villages and towns urban district,transaction sign,land sector position building sector house number plate,land shifting total area square meter,the use zoning or compiles and checks,the non-metropolis land use district,non-metropolis land use,transaction year month and day,transaction pen number,shifting level,total floor number,building state,main use,main building materials,construction to complete the years,building shifting total area,Building present situation pattern - room,building present situation pattern - hall,building present situation pattern - health,building present situation pattern - compartmented,Whether there is manages the organization,Whether there is attaches the furniture,total price NTD,the unit price (NTD / square meter),the berth category,berth shifting total area square meter,the berth total price NTD,the note,serial number
虎尾鎮,房地(土地+建物),雲林縣虎尾鎮芳草路31~60號,238.5,,鄉村區,乙種建築用地,1070524,土地1建物1車位0,全,,透天厝,,,,242.08,5,2,2,有,無,有,12000,50,,0.0,0,,RPVNMLLKOHNFFDP37DC
斗六市,建物,雲林縣斗六市西平路91~120號,198.0,住,,,1070605,土地0建物0車位0,四層,4,套房(1房1廳1衛),見其他登記事項,鋼筋混凝土造,1060607,16.53,1,0,1,有,無,有,8889,538,,0.0,0,租金含所得稅889元,RPSOMLOKOHNFFAP07CC
斗六市,建物,雲林縣斗六市西平路91~120號,198.0,住,,,1070605,土地0建物0車位0,四層,4,套房(1房1廳1衛),見其他登記事項,鋼筋混凝土造,1060607,19.84,1,0,1,有,無,有,10000,504,,0.0,0,租金含所得稅1000元。,RPTOMLOKOHNFFAP17CC
斗六市,建物,雲林縣斗六市西平路91~120號,198.0,住,,,1070605,土地0建物0車位0,四層,4,套房(1房1廳1衛),見其他登記事項,鋼筋混凝土造,1060607,16.53,1,0,1,有,無,有,8889,538,,0.0,0,租金含所得稅889元。,RPVOMLOKOHNFFAP37CC
斗六市,房地(土地+建物),雲林縣斗六市文化路151~180號,126.0,住,,,1070701,土地1建物1車位0,全,3,透天厝,住家用,見其他登記事項,0850320,60.0,4,1,3,有,無,有,19000,317,,0.0,0,有民情風俗因素之交易。;,RPOQMLKKPHNFFAP56CC
